{
  "$schema": "../../../schema/chart.schema.json",
  "format": "voxel-rhythm-chart",
  "version": 1,
  "meta": {
    "title": "NEON//DAEMON",
    "artist": "procedural (Web Audio)",
    "charter": "voxel-rhythm demo generator",
    "difficulty": "easy",
    "description": "Hyperpop demo loop generated in the browser. Lanes follow the instruments."
  },
  "audio": {
    "procedural": "hyperpop-demo",
    "lengthBeats": 220
  },
  "timing": {
    "bpm": 160,
    "offsetMs": 0,
    "beatsPerBar": 4
  },
  "lanes": [
    "kick",
    "perc",
    "bass",
    "synth"
  ],
  "notes": [
    {"beat": 0, "lane": "synth"},
    {"beat": 2, "lane": "synth"},
    {"beat": 4, "lane": "synth"},
    {"beat": 6, "lane": "synth"},
    {"beat": 8, "lane": "synth"},
    {"beat": 10, "lane": "synth"},
    {"beat": 12, "lane": "synth"},
    {"beat": 14, "lane": "synth"},
    {"beat": 16, "lane": "kick"},
    {"beat": 16, "lane": "bass", "length": 3},
    {"beat": 16, "lane": "synth"},
    {"beat": 18, "lane": "kick"},
    {"beat": 18, "lane": "synth"},
    {"beat": 19, "lane": "perc"},
    {"beat": 20, "lane": "kick"},
    {"beat": 20, "lane": "bass", "length": 3},
    {"beat": 20, "lane": "synth"},
    {"beat": 22, "lane": "kick"},
    {"beat": 22, "lane": "synth"},
    {"beat": 23, "lane": "perc"},
    {"beat": 24, "lane": "kick"},
    {"beat": 24, "lane": "bass", "length": 3},
    {"beat": 24, "lane": "synth"},
    {"beat": 26, "lane": "kick"},
    {"beat": 26, "lane": "synth"},
    {"beat": 27, "lane": "perc"},
    {"beat": 28, "lane": "kick"},
    {"beat": 28, "lane": "bass", "length": 3},
    {"beat": 28, "lane": "synth"},
    {"beat": 30, "lane": "kick"},
    {"beat": 30, "lane": "synth"},
    {"beat": 31, "lane": "perc"},
    {"beat": 32, "lane": "kick"},
    {"beat": 32, "lane": "bass", "length": 3},
    {"beat": 33, "lane": "perc"},
    {"beat": 34, "lane": "kick"},
    {"beat": 35, "lane": "perc"},
    {"beat": 36, "lane": "kick"},
    {"beat": 36, "lane": "bass", "length": 3},
    {"beat": 37, "lane": "perc"},
    {"beat": 38, "lane": "kick"},
    {"beat": 39, "lane": "perc"},
    {"beat": 40, "lane": "kick"},
    {"beat": 40, "lane": "bass", "length": 3},
    {"beat": 41, "lane": "perc"},
    {"beat": 42, "lane": "kick"},
    {"beat": 43, "lane": "perc"},
    {"beat": 44, "lane": "kick"},
    {"beat": 44, "lane": "bass", "length": 3},
    {"beat": 45, "lane": "perc"},
    {"beat": 47, "lane": "perc"},
    {"beat": 48, "lane": "kick"},
    {"beat": 48, "lane": "bass"},
    {"beat": 48, "lane": "synth"},
    {"beat": 49, "lane": "perc"},
    {"beat": 50, "lane": "synth"},
    {"beat": 51, "lane": "perc"},
    {"beat": 51, "lane": "bass"},
    {"beat": 52, "lane": "kick"},
    {"beat": 52, "lane": "bass", "length": 1.5},
    {"beat": 52, "lane": "synth"},
    {"beat": 53, "lane": "perc"},
    {"beat": 54, "lane": "kick"},
    {"beat": 54, "lane": "synth"},
    {"beat": 55, "lane": "perc"},
    {"beat": 56, "lane": "kick"},
    {"beat": 56, "lane": "bass"},
    {"beat": 56, "lane": "synth"},
    {"beat": 57, "lane": "perc"},
    {"beat": 58, "lane": "synth"},
    {"beat": 59, "lane": "perc"},
    {"beat": 59, "lane": "bass"},
    {"beat": 60, "lane": "kick"},
    {"beat": 60, "lane": "bass", "length": 1.5},
    {"beat": 60, "lane": "synth", "length": 1},
    {"beat": 61, "lane": "perc"},
    {"beat": 62, "lane": "kick"},
    {"beat": 62, "lane": "synth"},
    {"beat": 63, "lane": "perc"},
    {"beat": 64, "lane": "kick"},
    {"beat": 64, "lane": "bass"},
    {"beat": 64, "lane": "synth"},
    {"beat": 65, "lane": "perc"},
    {"beat": 66, "lane": "synth"},
    {"beat": 67, "lane": "perc"},
    {"beat": 67, "lane": "bass"},
    {"beat": 68, "lane": "kick"},
    {"beat": 68, "lane": "bass", "length": 1.5},
    {"beat": 68, "lane": "synth"},
    {"beat": 69, "lane": "perc"},
    {"beat": 70, "lane": "kick"},
    {"beat": 70, "lane": "synth"},
    {"beat": 71, "lane": "perc"},
    {"beat": 72, "lane": "kick"},
    {"beat": 72, "lane": "bass"},
    {"beat": 72, "lane": "synth"},
    {"beat": 73, "lane": "perc"},
    {"beat": 74, "lane": "synth"},
    {"beat": 75, "lane": "perc"},
    {"beat": 75, "lane": "bass"},
    {"beat": 76, "lane": "kick"},
    {"beat": 76, "lane": "bass", "length": 1.5},
    {"beat": 76, "lane": "synth", "length": 1},
    {"beat": 77, "lane": "perc"},
    {"beat": 78, "lane": "kick"},
    {"beat": 78, "lane": "synth"},
    {"beat": 79, "lane": "perc"},
    {"beat": 80, "lane": "kick"},
    {"beat": 80, "lane": "bass"},
    {"beat": 80, "lane": "synth"},
    {"beat": 81, "lane": "perc"},
    {"beat": 82, "lane": "synth"},
    {"beat": 83, "lane": "perc"},
    {"beat": 83, "lane": "bass"},
    {"beat": 84, "lane": "kick"},
    {"beat": 84, "lane": "bass", "length": 1.5},
    {"beat": 84, "lane": "synth"},
    {"beat": 85, "lane": "perc"},
    {"beat": 86, "lane": "kick"},
    {"beat": 86, "lane": "synth"},
    {"beat": 87, "lane": "perc"},
    {"beat": 88, "lane": "kick"},
    {"beat": 88, "lane": "bass"},
    {"beat": 88, "lane": "synth"},
    {"beat": 89, "lane": "perc"},
    {"beat": 90, "lane": "synth"},
    {"beat": 91, "lane": "perc"},
    {"beat": 91, "lane": "bass"},
    {"beat": 92, "lane": "kick"},
    {"beat": 92, "lane": "bass", "length": 1.5},
    {"beat": 92, "lane": "synth", "length": 1},
    {"beat": 93, "lane": "perc"},
    {"beat": 94, "lane": "kick"},
    {"beat": 94, "lane": "synth"},
    {"beat": 95, "lane": "perc"},
    {"beat": 96, "lane": "kick"},
    {"beat": 96, "lane": "bass"},
    {"beat": 96, "lane": "synth"},
    {"beat": 97, "lane": "perc"},
    {"beat": 98, "lane": "synth"},
    {"beat": 99, "lane": "perc"},
    {"beat": 99, "lane": "bass"},
    {"beat": 100, "lane": "kick"},
    {"beat": 100, "lane": "bass", "length": 1.5},
    {"beat": 100, "lane": "synth"},
    {"beat": 101, "lane": "perc"},
    {"beat": 102, "lane": "kick"},
    {"beat": 102, "lane": "synth"},
    {"beat": 103, "lane": "perc"},
    {"beat": 104, "lane": "kick"},
    {"beat": 104, "lane": "bass"},
    {"beat": 104, "lane": "synth"},
    {"beat": 105, "lane": "perc"},
    {"beat": 106, "lane": "synth"},
    {"beat": 107, "lane": "perc"},
    {"beat": 107, "lane": "bass"},
    {"beat": 108, "lane": "kick"},
    {"beat": 108, "lane": "bass", "length": 1.5},
    {"beat": 108, "lane": "synth", "length": 1},
    {"beat": 109, "lane": "perc"},
    {"beat": 110, "lane": "kick"},
    {"beat": 110, "lane": "synth"},
    {"beat": 111, "lane": "perc"},
    {"beat": 112, "lane": "bass", "length": 3},
    {"beat": 112, "lane": "synth"},
    {"beat": 114, "lane": "synth"},
    {"beat": 116, "lane": "bass", "length": 3},
    {"beat": 116, "lane": "synth"},
    {"beat": 118, "lane": "synth"},
    {"beat": 119, "lane": "perc"},
    {"beat": 120, "lane": "bass", "length": 3},
    {"beat": 120, "lane": "synth"},
    {"beat": 122, "lane": "synth"},
    {"beat": 124, "lane": "bass", "length": 3},
    {"beat": 124, "lane": "synth"},
    {"beat": 126, "lane": "synth"},
    {"beat": 127, "lane": "perc"},
    {"beat": 128, "lane": "bass", "length": 3},
    {"beat": 128, "lane": "synth"},
    {"beat": 130, "lane": "synth"},
    {"beat": 132, "lane": "bass", "length": 3},
    {"beat": 132, "lane": "synth"},
    {"beat": 134, "lane": "synth"},
    {"beat": 135, "lane": "perc"},
    {"beat": 136, "lane": "bass", "length": 3},
    {"beat": 136, "lane": "synth"},
    {"beat": 138, "lane": "synth"},
    {"beat": 140, "lane": "bass", "length": 3},
    {"beat": 140, "lane": "synth"},
    {"beat": 142, "lane": "synth"},
    {"beat": 143, "lane": "perc"},
    {"beat": 144, "lane": "kick"},
    {"beat": 144, "lane": "bass"},
    {"beat": 144, "lane": "synth"},
    {"beat": 145, "lane": "perc"},
    {"beat": 146, "lane": "synth"},
    {"beat": 147, "lane": "perc"},
    {"beat": 147, "lane": "bass"},
    {"beat": 148, "lane": "kick"},
    {"beat": 148, "lane": "bass", "length": 1.5},
    {"beat": 148, "lane": "synth"},
    {"beat": 149, "lane": "perc"},
    {"beat": 150, "lane": "kick"},
    {"beat": 150, "lane": "synth"},
    {"beat": 151, "lane": "perc"},
    {"beat": 152, "lane": "kick"},
    {"beat": 152, "lane": "bass"},
    {"beat": 152, "lane": "synth"},
    {"beat": 153, "lane": "perc"},
    {"beat": 154, "lane": "synth"},
    {"beat": 155, "lane": "perc"},
    {"beat": 155, "lane": "bass"},
    {"beat": 156, "lane": "kick"},
    {"beat": 156, "lane": "bass", "length": 1.5},
    {"beat": 156, "lane": "synth", "length": 1},
    {"beat": 157, "lane": "perc"},
    {"beat": 158, "lane": "kick"},
    {"beat": 158, "lane": "synth"},
    {"beat": 159, "lane": "perc"},
    {"beat": 160, "lane": "kick"},
    {"beat": 160, "lane": "bass"},
    {"beat": 160, "lane": "synth"},
    {"beat": 161, "lane": "perc"},
    {"beat": 162, "lane": "synth"},
    {"beat": 163, "lane": "perc"},
    {"beat": 163, "lane": "bass"},
    {"beat": 164, "lane": "kick"},
    {"beat": 164, "lane": "bass", "length": 1.5},
    {"beat": 164, "lane": "synth"},
    {"beat": 165, "lane": "perc"},
    {"beat": 166, "lane": "kick"},
    {"beat": 166, "lane": "synth"},
    {"beat": 167, "lane": "perc"},
    {"beat": 168, "lane": "kick"},
    {"beat": 168, "lane": "bass"},
    {"beat": 168, "lane": "synth"},
    {"beat": 169, "lane": "perc"},
    {"beat": 170, "lane": "synth"},
    {"beat": 171, "lane": "perc"},
    {"beat": 171, "lane": "bass"},
    {"beat": 172, "lane": "kick"},
    {"beat": 172, "lane": "bass", "length": 1.5},
    {"beat": 172, "lane": "synth", "length": 1},
    {"beat": 173, "lane": "perc"},
    {"beat": 174, "lane": "kick"},
    {"beat": 174, "lane": "synth"},
    {"beat": 175, "lane": "perc"},
    {"beat": 176, "lane": "kick"},
    {"beat": 176, "lane": "bass"},
    {"beat": 176, "lane": "synth"},
    {"beat": 177, "lane": "perc"},
    {"beat": 178, "lane": "synth"},
    {"beat": 179, "lane": "perc"},
    {"beat": 179, "lane": "bass"},
    {"beat": 180, "lane": "kick"},
    {"beat": 180, "lane": "bass", "length": 1.5},
    {"beat": 180, "lane": "synth"},